id,category,value,text
726,electronics,75.42,metrics metrics partition ui ui scala
727,books,80.54,row warehouse warehouse spark partition shuffle plan
728,electronics,79.08,filter reduce columnar etl spark map data reduce columnar elt map
729,books,22.93,lake lake lake join python
730,grocery,67.44,metrics elt elt shuffle etl data columnar elt spark etl plan scala
731,electronics,16.33,join join row columnar scala lake scala
732,grocery,34.84,row ui map lake map elt data
733,grocery,27.3,row elt row columnar ui join shuffle reduce plan lake
734,grocery,31.3,filter etl elt ui row metrics
735,electronics,92.7,spark columnar shuffle etl partition warehouse map elt lake
736,electronics,41.76,aggregate join reduce python filter
737,toys,75.78,data row plan shuffle warehouse ui row etl
738,toys,79.68,row plan join warehouse lake python
739,electronics,49.24,plan shuffle aggregate plan reduce plan warehouse map reduce plan warehouse
740,toys,23.45,shuffle aggregate lake columnar shuffle join elt
741,toys,30.61,scala reduce warehouse ui elt
742,electronics,29.41,join map spark ui elt scala row data warehouse columnar
743,books,10.13,join scala spark filter plan warehouse python row spark warehouse
744,books,63.61,metrics etl lake data shuffle join
745,grocery,29.68,filter map row lake row warehouse reduce elt ui
746,grocery,6.95,shuffle etl data map partition warehouse python columnar elt
747,grocery,68.79,partition columnar aggregate spark columnar elt ui partition
748,electronics,97.26,row elt metrics reduce lake scala row columnar spark ui
749,grocery,45.81,scala partition warehouse scala python python data python partition warehouse partition
750,electronics,89.33,metrics scala shuffle reduce elt
751,grocery,87.52,partition row warehouse shuffle partition
752,books,41.25,python elt reduce elt spark
753,electronics,12.05,join map partition elt filter
754,electronics,80.32,aggregate filter plan data row map data join lake map
755,electronics,91.84,map metrics shuffle scala row etl metrics map
756,grocery,35.32,elt columnar warehouse columnar columnar etl scala aggregate ui columnar data data
757,grocery,51.6,scala join aggregate elt warehouse ui scala data aggregate aggregate join aggregate
758,books,70.79,lake map map python columnar
759,grocery,45.42,lake data join reduce metrics warehouse scala lake map etl
760,grocery,62.31,lake metrics filter shuffle aggregate join map scala
761,electronics,4.04,join shuffle map elt metrics join map elt aggregate join
762,electronics,55.16,ui aggregate filter shuffle metrics map map elt filter
763,grocery,66.9,spark etl join spark join metrics ui python ui lake lake
764,toys,16.16,metrics filter filter row reduce etl row filter lake plan etl
765,grocery,76.43,python scala map scala aggregate data ui ui filter aggregate python
766,toys,10.96,filter partition plan map data aggregate elt python shuffle partition
767,books,18.62,map shuffle aggregate lake filter shuffle etl filter map
768,electronics,85.19,row filter metrics elt filter map map scala ui reduce
769,grocery,39.65,filter spark elt etl columnar spark
770,toys,75.17,columnar etl warehouse join reduce
771,electronics,71.57,row reduce shuffle warehouse partition scala lake shuffle ui scala plan
772,toys,26.38,reduce aggregate map python plan
773,books,26.94,python data join reduce partition partition shuffle elt scala
774,books,51.32,metrics reduce elt columnar map
775,books,8.41,elt elt map map partition
776,grocery,72.17,columnar metrics ui aggregate warehouse python warehouse warehouse aggregate data columnar
777,grocery,29.66,scala elt warehouse join metrics
778,books,58.61,etl shuffle lake metrics shuffle plan spark aggregate
779,grocery,81.34,aggregate scala row aggregate filter lake ui
780,electronics,82.97,elt reduce aggregate spark filter plan warehouse ui metrics reduce row
781,electronics,77.98,filter metrics python warehouse ui ui filter columnar
782,toys,81.39,spark join etl ui scala metrics
783,toys,23.43,metrics reduce elt filter python shuffle
784,toys,6.85,aggregate plan etl elt aggregate elt spark aggregate plan elt etl map
785,books,91.18,columnar data map elt reduce scala plan spark shuffle reduce plan
786,books,95.55,columnar python etl scala spark data plan reduce metrics
787,books,38.55,filter lake elt etl python warehouse filter etl join
788,books,98.88,row columnar data elt filter elt
789,grocery,64.26,scala etl elt map row
790,electronics,88.34,row columnar join scala aggregate
791,toys,77.49,elt metrics aggregate lake partition join partition join data reduce lake
792,toys,92.57,scala elt columnar metrics join
793,toys,55.25,warehouse warehouse row python plan
794,books,34.59,ui metrics spark filter reduce
795,grocery,15.12,plan data aggregate join plan row metrics
796,toys,21.15,metrics scala scala columnar shuffle python elt plan data partition filter python
797,electronics,79.57,scala reduce columnar shuffle shuffle
798,electronics,33.05,lake row plan shuffle scala partition scala shuffle data join partition
799,toys,82.29,python partition columnar scala columnar plan reduce python lake scala lake ui
800,electronics,82.19,aggregate partition columnar map elt row plan
801,toys,38.09,spark plan spark scala shuffle columnar ui elt
802,grocery,22.49,join spark join lake scala data plan shuffle
803,grocery,51.8,data map data warehouse columnar
804,toys,62.66,ui plan plan reduce filter plan columnar row join aggregate spark
805,books,52.9,warehouse aggregate partition ui ui map metrics elt lake elt
806,grocery,2.71,python scala row plan lake elt row lake shuffle
807,grocery,99.03,warehouse shuffle map row reduce ui
808,electronics,35.98,partition ui join reduce columnar
809,grocery,95.64,metrics elt join spark partition join elt join partition
810,books,30.87,filter warehouse lake data spark etl etl elt aggregate
811,grocery,26.83,etl join warehouse join map aggregate scala spark row join ui elt
812,grocery,65.26,spark python etl ui elt filter map map warehouse plan elt warehouse
813,books,36.67,data ui ui lake etl aggregate metrics warehouse
814,toys,49.79,join warehouse row row filter
815,electronics,98.64,row etl aggregate shuffle partition elt filter reduce data aggregate reduce
816,electronics,8.76,aggregate warehouse ui elt plan spark
817,toys,37.83,scala row ui etl lake columnar join elt spark row reduce ui
818,books,5.63,columnar reduce etl etl data
819,grocery,73.04,plan warehouse scala shuffle filter metrics
820,grocery,29.8,scala shuffle aggregate lake row metrics plan warehouse map etl join
821,electronics,10.14,row etl join partition join aggregate metrics etl shuffle
822,electronics,65.61,metrics etl reduce etl plan shuffle
823,grocery,17.71,aggregate filter filter filter warehouse reduce
824,toys,55.5,row columnar elt reduce warehouse metrics scala etl etl ui shuffle reduce
825,books,30.72,elt scala join scala scala elt plan row plan lake spark lake
826,electronics,94.04,elt reduce plan row reduce
827,toys,28.27,join row metrics scala row row
828,grocery,73.79,lake elt lake join aggregate etl plan ui row
829,toys,83.7,reduce etl plan map spark shuffle columnar data
830,books,62.86,row spark lake data columnar warehouse row map
831,books,62.13,data data data python plan row
832,toys,34.59,columnar join data aggregate plan plan filter
833,toys,54.04,data ui columnar map reduce spark shuffle metrics spark
834,books,2.47,filter partition elt data partition ui scala scala partition reduce join
835,toys,63.13,data map elt scala join warehouse metrics warehouse row shuffle aggregate warehouse
836,grocery,6.28,join etl shuffle row row scala elt spark lake lake scala
837,toys,90.5,filter row reduce scala warehouse shuffle plan
838,books,43.45,etl data partition scala aggregate scala etl warehouse columnar partition lake reduce
839,electronics,89.89,data elt data ui metrics row
840,toys,63.78,warehouse warehouse elt ui python join reduce
841,books,50.02,data lake join lake shuffle
842,toys,90.48,elt scala plan ui python
843,toys,30.72,aggregate scala scala map etl filter filter plan shuffle
844,electronics,86.76,warehouse data shuffle aggregate etl etl scala plan
845,toys,33.26,spark python reduce aggregate ui scala row metrics columnar
846,toys,87.28,filter map reduce metrics columnar metrics aggregate
847,toys,17.84,elt etl python shuffle partition
848,toys,18.07,scala elt scala elt spark lake data etl shuffle aggregate
849,electronics,34.32,filter elt columnar aggregate spark row
850,toys,26.24,etl etl lake partition warehouse ui etl join metrics scala
851,toys,18.71,shuffle filter row elt metrics metrics
852,electronics,4.18,ui row ui columnar metrics
853,grocery,46.53,ui columnar join scala row filter
854,electronics,46.07,elt metrics elt columnar plan map
855,electronics,9.39,row map etl warehouse etl join spark row reduce
856,toys,60.95,lake elt reduce filter plan data reduce scala python lake elt
857,toys,92.57,join plan partition etl plan
858,books,2.17,data row data aggregate map join spark aggregate data lake
859,books,42.03,shuffle plan data lake reduce lake join columnar shuffle
860,grocery,49.85,data plan filter data etl data reduce data metrics row shuffle
861,grocery,43.27,columnar partition warehouse filter shuffle lake plan map
862,toys,7.43,partition row row shuffle filter ui lake columnar etl
863,books,43.42,columnar columnar lake python plan partition shuffle filter
864,books,79.2,etl join warehouse warehouse scala columnar reduce aggregate join data
865,toys,45.49,map partition scala join columnar columnar metrics plan row data aggregate lake
866,books,11.59,reduce reduce shuffle plan warehouse join row shuffle
867,toys,94.73,warehouse row metrics aggregate data lake elt plan warehouse
868,grocery,98.3,data filter elt warehouse warehouse
869,electronics,73.95,python lake warehouse elt map reduce elt
870,electronics,26.68,elt row metrics aggregate plan filter
871,grocery,5.43,map ui shuffle warehouse reduce
872,electronics,11.97,shuffle python filter aggregate plan aggregate partition
873,electronics,24.19,data data row join spark filter
874,grocery,49.27,data data elt ui data warehouse partition partition elt reduce warehouse ui
875,books,3.28,scala partition columnar map join reduce reduce map metrics python plan shuffle
876,toys,92.08,shuffle elt etl spark shuffle scala join ui elt etl
877,electronics,42.14,lake partition filter etl ui
878,toys,44.98,shuffle ui elt shuffle warehouse lake data metrics scala aggregate shuffle python
879,toys,55.41,filter plan spark join etl metrics ui
880,books,58.65,data lake elt metrics lake map data data python join
881,electronics,23.37,data metrics scala partition aggregate ui lake filter ui aggregate filter
882,books,80.55,elt etl scala filter map shuffle row elt warehouse elt
883,books,57.25,shuffle scala partition lake map
884,electronics,45.38,join partition shuffle ui elt ui metrics map python partition
885,books,64.74,partition ui plan map scala
886,grocery,25.53,shuffle data shuffle python metrics data row row lake row plan filter
887,toys,87.11,ui partition plan row shuffle plan ui join
888,toys,85.62,metrics lake join python metrics metrics map elt scala ui
889,toys,92.77,scala metrics join row python filter spark map shuffle python data
890,grocery,21.39,spark aggregate plan plan scala row filter columnar elt plan
891,grocery,47.67,row spark data spark join lake etl row scala
892,books,38.96,metrics map filter ui python reduce filter lake data
893,books,16.32,spark partition join metrics scala elt filter
894,electronics,57.94,map shuffle aggregate join ui data etl row reduce map
895,books,54.81,reduce row plan lake warehouse
896,toys,79.01,row partition columnar warehouse scala
897,electronics,80.85,join metrics warehouse columnar columnar join data partition reduce scala data
898,toys,18.22,partition warehouse warehouse ui scala partition partition row aggregate python
899,books,37.09,spark join python plan partition ui
900,books,71.06,partition join lake warehouse shuffle scala join scala
901,toys,17.85,etl join shuffle etl scala scala aggregate warehouse columnar warehouse
902,electronics,11.23,scala warehouse etl metrics data ui join columnar
903,electronics,51.78,etl reduce ui etl plan
904,grocery,10.06,partition ui partition partition warehouse reduce
905,books,98.24,aggregate elt scala python spark filter
906,grocery,84.06,shuffle row shuffle partition plan etl columnar scala
907,grocery,39.95,data elt lake lake partition ui ui warehouse warehouse
908,books,39.26,warehouse filter python python scala metrics join
909,books,15.72,ui reduce partition map spark
910,books,80.79,join etl python filter aggregate
911,grocery,1.91,map partition data reduce partition plan plan shuffle
912,books,55.07,filter spark scala warehouse spark etl metrics scala spark ui
913,grocery,57.24,data data aggregate scala ui reduce lake
914,grocery,9.63,lake filter aggregate columnar map partition elt filter
915,electronics,52.91,elt metrics warehouse ui reduce
916,electronics,24.58,lake lake map partition spark plan elt metrics metrics map
917,electronics,20.41,metrics scala scala row row spark join
918,toys,6.43,map spark etl partition data warehouse spark data etl ui
919,toys,76.33,spark filter aggregate shuffle columnar spark warehouse data metrics join aggregate metrics
920,grocery,74.16,python spark shuffle partition columnar plan partition partition filter ui
921,toys,28.23,metrics join etl python aggregate
922,books,30.24,join python python elt reduce ui plan etl
923,electronics,93.36,lake scala scala data row columnar map columnar lake spark scala
924,electronics,93.51,partition map aggregate row metrics ui python
925,grocery,30.68,python etl elt scala columnar scala scala lake map
926,books,31.61,metrics python partition warehouse reduce etl spark elt
927,electronics,79.05,python row data shuffle lake metrics
928,toys,23.02,filter shuffle join plan partition filter
929,toys,17.07,metrics elt scala join python plan metrics etl row data row
930,toys,6.15,columnar aggregate partition partition reduce plan map elt
931,grocery,87.86,metrics partition row ui aggregate metrics row python row ui scala plan
932,grocery,95.91,scala plan row ui scala warehouse data warehouse
933,electronics,68.89,row reduce metrics data python
934,books,22.74,aggregate map etl elt metrics
935,electronics,32.29,columnar scala shuffle data join
936,electronics,90.31,partition plan plan ui filter filter reduce aggregate
937,toys,92.56,ui spark partition elt warehouse columnar
938,toys,58.98,etl etl ui plan partition
939,grocery,68.41,ui filter elt lake join
940,toys,56.3,partition scala columnar shuffle python plan row
941,electronics,12.89,lake shuffle partition python join warehouse partition row data spark shuffle
942,grocery,77.45,metrics aggregate aggregate join etl spark shuffle shuffle
943,electronics,69.18,scala metrics plan data spark shuffle plan row scala plan row reduce
944,toys,97.74,etl elt filter metrics data plan shuffle map scala columnar
945,toys,53.42,metrics metrics filter filter aggregate join partition map row shuffle reduce plan
946,books,34.18,row data join join elt etl aggregate
947,grocery,82.53,aggregate reduce etl lake map spark
948,grocery,87.73,elt plan join metrics aggregate data shuffle
949,books,44.85,elt spark ui spark shuffle aggregate scala python spark map map
950,grocery,40.23,filter warehouse partition metrics lake data filter metrics warehouse lake filter python
951,books,50.46,lake row filter elt map etl elt python data partition filter plan
952,toys,87.16,ui reduce shuffle join etl columnar row etl
953,grocery,59.38,reduce row partition ui metrics metrics python reduce scala join lake
954,toys,65.18,aggregate scala filter elt scala metrics elt data reduce etl
955,electronics,92.38,elt reduce scala etl spark
956,grocery,29.57,reduce join ui shuffle plan elt etl elt
957,grocery,45.71,data data python warehouse shuffle python join columnar elt row plan elt
958,electronics,65.58,row partition spark elt python warehouse ui scala data row data
959,electronics,58.31,aggregate shuffle map shuffle shuffle python row filter plan etl
960,books,55.96,etl ui join columnar columnar etl columnar spark python plan etl warehouse
961,toys,38.72,plan reduce map aggregate reduce spark warehouse metrics
962,grocery,92.23,plan map spark elt ui shuffle warehouse
963,electronics,70.34,spark lake python metrics filter join spark
964,electronics,88.51,aggregate python elt plan partition
965,books,22.59,warehouse elt ui reduce aggregate
966,electronics,87.92,etl map columnar aggregate aggregate join
967,electronics,1.74,metrics python scala lake lake data reduce elt warehouse metrics
968,electronics,53.87,partition python shuffle plan scala python
969,electronics,87.1,lake reduce metrics join shuffle aggregate filter etl data ui
970,grocery,97.91,filter metrics shuffle spark lake scala columnar partition spark
971,grocery,83.95,python scala join shuffle reduce scala join spark reduce plan
972,grocery,42.62,join reduce warehouse warehouse metrics spark ui scala partition
973,books,44.79,reduce lake reduce partition lake
974,books,6.38,row columnar ui aggregate plan reduce spark
975,grocery,81.7,python scala reduce metrics columnar filter shuffle ui lake join warehouse
976,toys,67.03,warehouse metrics join aggregate partition
977,toys,12.07,spark reduce data elt row filter spark
978,grocery,40.0,lake filter columnar metrics filter elt map data aggregate warehouse columnar join
979,books,17.69,python scala map plan partition columnar aggregate spark filter aggregate
980,grocery,26.63,aggregate metrics warehouse elt partition
981,books,23.5,elt ui plan aggregate python aggregate partition map ui plan shuffle data
982,books,65.89,python aggregate data join plan plan shuffle
983,electronics,34.26,shuffle aggregate filter python shuffle columnar filter
984,electronics,26.51,shuffle metrics aggregate data plan warehouse columnar scala etl columnar shuffle filter
985,toys,75.81,python filter spark scala columnar scala shuffle join etl metrics metrics plan
986,toys,8.79,shuffle data python lake ui row columnar columnar row partition
987,electronics,82.37,metrics map scala elt join plan join columnar
988,toys,85.1,join filter elt join warehouse scala join elt lake etl scala
989,grocery,59.04,warehouse warehouse data columnar warehouse join row map data data columnar
990,books,98.83,spark ui python metrics map data python aggregate partition
991,books,89.08,elt metrics metrics scala data lake lake
992,grocery,23.58,reduce lake reduce elt row elt data metrics join join metrics warehouse
993,books,25.81,metrics row data join columnar lake shuffle row
994,grocery,3.26,ui data aggregate plan join row row filter columnar
995,books,14.51,lake scala data spark scala lake partition etl reduce shuffle
996,books,26.96,warehouse elt shuffle warehouse metrics
997,books,59.27,partition row etl shuffle etl
998,grocery,81.41,etl shuffle etl reduce map ui scala filter plan filter filter
999,electronics,35.8,partition shuffle plan reduce metrics partition aggregate columnar warehouse map
1000,books,10.04,lake join partition plan etl metrics reduce row
1001,electronics,14.91,plan reduce etl lake row row map columnar spark warehouse shuffle aggregate
1002,electronics,55.5,reduce aggregate map lake lake scala columnar
1003,electronics,13.21,data columnar warehouse plan python python data
1004,toys,5.28,ui warehouse scala plan shuffle reduce shuffle reduce metrics shuffle python lake
1005,grocery,47.79,ui warehouse scala python warehouse aggregate elt
1006,electronics,56.14,reduce join partition ui shuffle ui ui
1007,toys,53.9,python metrics warehouse aggregate ui shuffle etl metrics spark
1008,books,3.97,reduce filter elt partition join join data python join row
1009,books,60.39,row partition metrics etl columnar scala row etl shuffle reduce
1010,toys,7.73,warehouse data reduce join plan plan join row partition reduce columnar
1011,electronics,11.66,reduce python elt row metrics filter etl shuffle columnar plan row filter
1012,electronics,10.06,filter lake spark join aggregate partition metrics
1013,toys,12.63,columnar columnar lake join row partition metrics map partition etl filter
1014,toys,88.16,warehouse data aggregate python ui spark spark
1015,electronics,1.85,plan ui metrics aggregate ui
1016,books,20.23,lake join spark row lake etl metrics lake metrics spark
1017,toys,36.63,data warehouse spark plan partition reduce reduce ui partition plan
1018,books,50.43,spark shuffle spark data aggregate etl scala etl
1019,toys,21.4,map join partition aggregate columnar aggregate row etl etl warehouse data elt
1020,electronics,79.2,python etl reduce metrics plan warehouse partition shuffle join etl etl filter
1021,grocery,19.05,plan elt elt plan lake plan spark plan data
1022,toys,77.56,etl elt data python row
1023,books,78.54,columnar map aggregate scala reduce
1024,grocery,81.83,data join join join ui join metrics
1025,toys,75.72,lake map warehouse warehouse spark spark
1026,grocery,13.91,partition metrics reduce plan scala join lake aggregate row python row
1027,books,80.7,lake elt etl plan python warehouse map ui
1028,electronics,65.99,plan spark etl metrics partition data data map filter partition
1029,electronics,53.83,plan shuffle data shuffle lake row python lake partition partition
1030,grocery,35.25,warehouse ui join scala partition filter metrics map ui spark row
1031,electronics,42.82,plan data elt etl data map
1032,grocery,63.69,plan join python plan etl etl lake row filter
1033,electronics,73.62,elt plan map filter lake lake shuffle lake etl python
1034,grocery,28.73,shuffle elt aggregate columnar plan filter columnar columnar warehouse
1035,grocery,1.38,scala join shuffle shuffle row columnar partition metrics shuffle spark map spark
1036,books,87.68,columnar shuffle partition scala shuffle reduce reduce map join python filter
1037,toys,63.77,partition ui metrics ui data reduce
1038,electronics,93.07,warehouse data plan metrics warehouse
1039,books,89.03,lake data partition metrics etl row lake
1040,electronics,66.64,map columnar map lake spark elt map map elt
1041,grocery,97.88,filter ui warehouse shuffle lake aggregate spark elt
1042,books,92.45,filter scala scala filter filter aggregate ui filter row
1043,toys,28.95,ui filter filter partition partition warehouse row row reduce spark
1044,electronics,8.55,warehouse partition metrics scala elt ui reduce data spark scala map filter
1045,toys,2.31,python row join reduce filter filter elt scala ui
1046,books,32.79,python metrics ui plan warehouse columnar row warehouse etl spark filter
1047,electronics,40.18,aggregate reduce data aggregate plan row
1048,books,97.64,plan map spark data plan
1049,books,69.06,join lake metrics spark reduce etl
1050,toys,27.86,data reduce aggregate etl lake reduce shuffle
1051,toys,15.29,python row python map partition plan
1052,toys,80.37,partition filter ui elt columnar etl partition data
1053,toys,85.89,plan etl python spark ui row aggregate shuffle lake row partition
1054,books,58.8,elt lake aggregate aggregate spark metrics warehouse reduce metrics ui
1055,electronics,76.61,data ui partition etl etl partition elt columnar row aggregate join aggregate
1056,grocery,68.17,filter scala etl data warehouse python ui map ui filter join join
1057,books,11.08,map partition scala scala etl
1058,grocery,35.47,columnar shuffle python row elt lake shuffle scala shuffle data
1059,toys,72.6,reduce map scala filter map
1060,books,87.51,data plan spark shuffle shuffle data
1061,electronics,87.92,etl metrics python shuffle ui metrics
1062,toys,25.7,python etl shuffle aggregate filter
1063,grocery,61.56,columnar ui row spark reduce
1064,toys,5.87,spark scala elt reduce reduce lake lake metrics row aggregate spark row
1065,toys,37.45,row partition row scala ui partition metrics python data lake
1066,electronics,34.6,shuffle metrics warehouse filter data
1067,toys,0.15,shuffle scala spark columnar warehouse
1068,toys,28.47,reduce shuffle scala columnar map
1069,electronics,87.04,map etl scala etl python partition shuffle columnar
1070,electronics,35.88,shuffle join scala partition spark spark
1071,grocery,29.59,ui ui spark partition data elt scala shuffle reduce
1072,electronics,80.46,spark columnar metrics python shuffle partition plan reduce reduce
1073,toys,35.19,map partition plan etl etl etl etl row elt aggregate map partition
1074,grocery,18.7,row warehouse ui columnar columnar elt lake
1075,electronics,38.09,data warehouse aggregate scala join
1076,books,91.2,spark columnar scala partition join shuffle spark columnar
1077,toys,95.97,spark ui ui map etl row
1078,toys,46.38,row row etl spark columnar
1079,grocery,37.48,aggregate elt data warehouse data metrics ui
1080,books,9.38,etl partition shuffle filter map etl metrics reduce etl
1081,grocery,38.43,map metrics spark scala aggregate
1082,grocery,89.25,ui filter filter aggregate warehouse metrics columnar
1083,grocery,33.6,spark row columnar filter filter data ui shuffle map plan filter spark
1084,grocery,77.48,spark columnar warehouse row etl metrics filter
1085,toys,71.62,join metrics elt lake shuffle reduce data elt spark
1086,books,2.66,columnar partition partition columnar reduce join reduce filter lake shuffle aggregate
1087,toys,78.0,ui python warehouse elt join data plan columnar warehouse python shuffle plan
1088,toys,54.95,lake etl shuffle shuffle lake filter elt shuffle filter scala metrics columnar
1089,books,76.54,filter spark scala scala map partition metrics lake
1090,toys,67.12,ui shuffle row lake partition reduce data map join
