id,category,value,text
371,grocery,28.04,spark filter etl python filter aggregate plan spark data row metrics
372,toys,24.08,metrics scala python etl elt plan join scala ui etl data
373,electronics,58.28,data reduce scala aggregate warehouse
374,grocery,73.17,scala spark etl spark reduce map plan lake lake lake partition row
375,books,93.92,filter ui columnar ui filter join metrics spark partition join columnar reduce
376,grocery,60.17,lake map data data aggregate metrics map reduce
377,books,68.94,aggregate filter map python aggregate plan
378,books,44.5,shuffle elt metrics python scala plan python row
379,grocery,29.68,join filter columnar spark aggregate spark etl partition join metrics ui reduce
380,electronics,77.16,warehouse plan ui reduce ui reduce map row warehouse
381,books,7.31,warehouse map map etl scala python elt
382,grocery,81.37,elt lake aggregate warehouse warehouse data reduce row
383,grocery,34.39,row etl row ui scala row lake
384,electronics,45.83,data filter metrics aggregate elt shuffle partition partition scala reduce plan warehouse
385,toys,33.75,python columnar partition scala metrics shuffle lake warehouse python
386,grocery,52.52,map aggregate plan row row columnar warehouse metrics shuffle
387,toys,26.24,metrics warehouse reduce row columnar row join columnar
388,electronics,26.72,elt scala columnar ui filter ui elt elt elt shuffle
389,books,53.79,aggregate data map aggregate partition scala spark lake map metrics
390,toys,5.05,plan row map metrics python python
391,electronics,77.05,data columnar plan elt map columnar warehouse data data metrics metrics
392,toys,65.37,spark aggregate python scala data plan elt lake shuffle metrics plan data
393,grocery,54.61,scala aggregate warehouse scala join aggregate aggregate etl warehouse etl
394,toys,85.83,lake join map map lake warehouse
395,toys,78.69,scala aggregate row row plan metrics
396,toys,56.48,reduce filter ui warehouse plan ui etl aggregate scala metrics spark
397,electronics,37.98,plan warehouse lake row lake
398,grocery,90.29,metrics join reduce scala scala warehouse warehouse ui
399,grocery,99.53,partition metrics join filter data filter map reduce ui warehouse python
400,books,45.48,columnar warehouse spark warehouse metrics map map shuffle aggregate scala ui row
401,books,58.48,join join columnar partition row scala python columnar data columnar aggregate reduce
402,toys,92.44,map row metrics scala spark aggregate data columnar
403,grocery,52.05,plan etl lake shuffle map reduce ui shuffle warehouse
404,electronics,3.07,columnar join scala elt filter scala
405,electronics,15.64,warehouse reduce metrics ui elt lake ui reduce etl
406,books,38.17,row shuffle lake shuffle columnar scala filter etl
407,toys,35.04,warehouse aggregate columnar reduce spark etl lake aggregate lake join scala plan
408,electronics,77.58,filter data plan spark warehouse python spark
409,books,40.85,ui filter row ui reduce
410,books,89.73,reduce reduce filter partition etl partition
411,grocery,93.15,filter spark reduce reduce map data warehouse shuffle data shuffle reduce python
412,books,27.7,elt plan etl spark elt metrics shuffle
413,grocery,71.51,ui spark partition lake data scala data python metrics scala
414,books,23.8,partition shuffle ui aggregate warehouse partition partition scala shuffle join python join
415,toys,34.85,metrics metrics data ui python
416,toys,40.32,warehouse etl data data map shuffle warehouse shuffle columnar
417,electronics,69.21,ui columnar elt filter row columnar join
418,electronics,53.65,ui row python metrics lake
419,books,50.69,metrics aggregate reduce data plan warehouse warehouse spark join ui
420,electronics,13.13,spark data warehouse scala spark scala columnar metrics filter ui aggregate partition
421,books,76.81,reduce scala shuffle lake data warehouse plan join partition data scala
422,toys,22.79,filter data reduce filter filter shuffle metrics aggregate filter reduce
423,grocery,4.46,row row scala partition shuffle metrics python
424,toys,6.45,aggregate filter map map elt etl metrics
425,electronics,13.2,join elt filter filter etl lake etl
426,toys,83.97,shuffle partition shuffle data partition warehouse lake warehouse columnar metrics
427,grocery,21.79,metrics map data warehouse spark filter
428,toys,98.5,scala row etl metrics filter shuffle
429,toys,68.76,python data ui columnar reduce metrics etl warehouse
430,toys,48.37,filter lake aggregate etl data reduce python spark metrics
431,books,47.96,lake metrics elt plan python warehouse spark shuffle etl
432,grocery,57.23,map elt map filter elt ui metrics
433,books,9.77,etl row warehouse python lake shuffle etl filter metrics data scala aggregate
434,electronics,30.32,python data scala lake reduce columnar aggregate filter elt row lake metrics
435,toys,41.76,row shuffle ui ui ui ui spark
436,toys,63.39,etl elt aggregate warehouse plan data
437,electronics,61.27,aggregate partition spark join warehouse lake filter elt reduce shuffle ui columnar
438,grocery,67.6,ui row spark lake columnar scala plan plan
439,electronics,5.94,elt reduce plan etl warehouse map
440,toys,37.17,data warehouse warehouse metrics lake map filter partition metrics
441,electronics,61.81,etl filter columnar aggregate lake shuffle lake plan warehouse metrics
442,grocery,88.07,map reduce shuffle lake join
443,toys,78.62,python spark columnar python scala columnar metrics
444,toys,0.38,filter map warehouse lake reduce
445,books,29.68,join elt data map lake etl
446,toys,14.22,shuffle ui data shuffle data join
447,grocery,60.8,spark reduce warehouse scala warehouse etl shuffle plan filter python shuffle
448,grocery,44.43,partition partition filter plan reduce lake shuffle
449,electronics,16.72,shuffle aggregate elt spark ui aggregate filter elt join
450,toys,63.48,elt elt metrics row etl etl lake
451,books,64.2,filter plan lake reduce data spark elt partition map partition
452,toys,60.7,python join shuffle reduce data elt reduce ui python
453,grocery,64.42,elt row filter metrics columnar python metrics scala join shuffle shuffle
454,books,33.93,filter partition spark row etl shuffle partition reduce aggregate
455,grocery,56.64,row aggregate shuffle reduce join elt join
456,grocery,45.69,columnar data data ui python partition lake columnar map metrics columnar lake
457,grocery,29.61,columnar lake elt warehouse aggregate
458,books,24.45,warehouse map elt shuffle warehouse plan lake elt lake warehouse
459,electronics,22.67,aggregate elt warehouse etl spark join lake partition warehouse metrics ui
460,electronics,81.69,filter scala python warehouse map shuffle
461,grocery,11.48,lake map columnar partition shuffle ui lake aggregate python shuffle python
462,grocery,20.24,row join map row etl aggregate plan lake ui join
463,grocery,22.67,elt filter warehouse filter warehouse plan plan columnar
464,electronics,38.56,elt shuffle lake shuffle etl join partition lake python data
465,toys,88.83,reduce shuffle shuffle warehouse data metrics etl metrics
466,books,44.42,ui warehouse ui metrics ui shuffle map scala join ui join
467,books,10.0,aggregate warehouse columnar scala plan scala shuffle row
468,electronics,0.21,shuffle join warehouse reduce aggregate elt map lake shuffle etl
469,electronics,4.2,partition row shuffle columnar metrics metrics
470,electronics,21.11,spark reduce data join reduce spark spark join aggregate metrics
471,grocery,72.01,row join shuffle shuffle lake filter etl
472,toys,15.43,filter partition elt scala metrics aggregate metrics plan warehouse lake
473,books,76.96,data lake warehouse row filter plan filter
474,electronics,56.24,map shuffle plan etl columnar etl elt
475,electronics,41.87,map metrics data elt metrics scala warehouse map data filter
476,grocery,10.06,aggregate python partition filter map warehouse
477,toys,8.82,aggregate python columnar spark plan ui reduce spark python
478,grocery,65.46,filter join lake shuffle columnar
479,toys,12.64,elt data shuffle aggregate columnar ui partition warehouse elt aggregate
480,books,0.31,map etl lake columnar elt plan etl columnar plan shuffle etl python
481,toys,79.11,columnar shuffle etl data plan filter metrics row plan row
482,books,85.22,columnar reduce etl map scala spark elt ui
483,books,19.8,map filter partition warehouse columnar row data warehouse etl
484,electronics,46.1,spark python shuffle shuffle lake etl partition plan map etl metrics join
485,grocery,70.45,scala python join scala scala columnar reduce ui warehouse spark data map
486,electronics,44.72,shuffle ui join elt metrics
487,toys,29.27,plan reduce partition partition columnar lake lake join
488,toys,87.2,partition row filter scala etl metrics elt
489,books,1.45,metrics data partition etl python data map reduce join filter elt partition
490,grocery,53.3,data shuffle join elt row reduce data shuffle ui spark ui
491,books,23.29,spark etl ui aggregate spark map join reduce row filter warehouse
492,books,49.26,partition spark etl partition etl data map shuffle etl lake python scala
493,toys,15.5,etl plan filter python shuffle
494,books,96.67,data partition scala map etl elt spark columnar
495,grocery,95.13,python filter etl row python columnar
496,toys,46.69,elt row map elt spark lake scala metrics ui columnar ui reduce
497,electronics,44.78,scala partition plan row columnar shuffle spark partition join row elt
498,electronics,48.23,filter reduce columnar python shuffle
499,toys,95.63,aggregate shuffle plan join aggregate lake
500,electronics,80.48,lake row reduce row shuffle elt row data plan columnar
501,grocery,92.82,aggregate metrics filter partition ui reduce join warehouse elt
502,electronics,84.56,join aggregate metrics shuffle lake plan etl map partition warehouse
503,grocery,99.32,warehouse data join row filter reduce python warehouse ui
504,toys,10.9,etl reduce lake python elt shuffle elt elt python reduce
505,books,80.67,spark ui data data plan row spark shuffle lake lake data join
506,grocery,24.05,partition plan join warehouse warehouse metrics lake filter python row ui columnar
507,toys,68.34,warehouse plan map filter elt lake aggregate columnar metrics
508,electronics,14.44,map elt elt aggregate reduce reduce lake lake python
509,grocery,74.91,join spark row aggregate elt
510,toys,42.69,lake lake scala metrics metrics warehouse python row reduce
511,grocery,23.29,plan etl elt columnar ui ui spark python warehouse etl python
512,electronics,68.51,row warehouse join elt aggregate metrics
513,books,65.37,spark plan join python aggregate row scala warehouse map metrics
514,electronics,15.52,ui lake map scala shuffle map
515,toys,9.54,warehouse reduce metrics data data
516,electronics,4.02,shuffle row warehouse aggregate columnar elt plan python
517,books,21.95,data reduce elt python shuffle row
518,electronics,21.97,map filter scala filter ui join
519,books,80.93,plan lake data etl spark
520,toys,67.67,data aggregate map spark warehouse
521,electronics,75.84,lake partition map aggregate data scala python scala join filter partition row
522,electronics,23.5,warehouse scala filter elt ui columnar filter
523,books,61.74,elt warehouse join plan shuffle filter reduce row
524,grocery,44.79,ui warehouse etl spark warehouse lake join plan lake columnar reduce data
525,toys,48.76,etl elt shuffle row map map elt lake
526,toys,91.59,reduce etl scala data map elt join join ui filter data
527,toys,68.37,python join metrics ui shuffle filter metrics shuffle ui
528,toys,97.04,row metrics metrics aggregate lake lake partition
529,toys,5.56,reduce warehouse reduce shuffle partition join map lake reduce
530,electronics,56.61,etl row partition data metrics metrics aggregate
531,grocery,6.18,elt scala columnar shuffle warehouse filter scala
532,toys,88.0,metrics shuffle etl ui warehouse warehouse map partition etl
533,electronics,57.2,reduce scala elt map columnar spark columnar etl join
534,grocery,77.92,join map python filter shuffle
535,toys,94.87,metrics columnar scala metrics aggregate elt columnar elt
536,grocery,70.8,elt reduce etl partition reduce elt elt scala
537,books,44.18,elt reduce columnar reduce elt warehouse elt columnar join filter plan etl
538,toys,50.44,python shuffle elt join shuffle scala plan join filter partition data
539,grocery,75.18,shuffle row partition plan row
540,books,27.11,warehouse elt scala lake shuffle map scala plan aggregate
541,books,66.11,metrics aggregate partition scala filter
542,toys,9.0,plan lake ui filter row metrics etl elt etl
543,grocery,99.34,columnar join metrics columnar filter spark row
544,books,64.01,elt lake row plan reduce partition elt warehouse partition join
545,books,60.48,scala warehouse lake data spark
546,electronics,15.12,columnar join join ui filter scala lake partition scala partition metrics warehouse
547,grocery,57.54,metrics ui lake lake partition python ui filter join join shuffle warehouse
548,books,55.31,ui python row aggregate map map aggregate
549,books,37.25,columnar filter lake partition plan shuffle python spark metrics join ui
550,electronics,63.04,filter elt join reduce row data shuffle ui
551,toys,23.07,partition data lake spark shuffle elt data python data map
552,books,20.26,ui map partition filter data scala shuffle warehouse shuffle shuffle
553,electronics,24.82,metrics map map join ui aggregate shuffle warehouse metrics
554,grocery,0.19,warehouse aggregate row spark filter
555,books,20.39,aggregate plan spark data metrics elt etl etl scala
556,grocery,65.21,python filter data lake elt elt aggregate map
557,electronics,18.34,plan join scala columnar scala elt shuffle scala lake reduce spark reduce
558,electronics,47.11,filter row partition partition ui map shuffle warehouse data
559,books,26.82,spark aggregate columnar metrics elt etl plan join
560,books,50.78,aggregate partition columnar lake data partition
561,electronics,35.26,etl columnar elt aggregate aggregate ui plan aggregate filter elt
562,books,34.48,partition row lake python shuffle ui join map scala metrics metrics metrics
563,grocery,8.8,elt filter warehouse ui scala etl partition columnar plan shuffle join
564,books,11.69,lake warehouse row aggregate aggregate columnar
565,toys,73.96,plan map lake ui spark
566,toys,53.18,elt plan join metrics data
567,grocery,75.15,plan join spark row partition map reduce join spark elt reduce
568,toys,53.68,filter lake spark data partition spark row row columnar ui spark plan
569,toys,43.11,scala map lake partition elt etl python join row
570,grocery,21.61,scala aggregate scala row reduce aggregate join ui
571,grocery,25.04,elt map python shuffle elt plan
572,electronics,63.04,join spark plan filter reduce python spark ui join elt
573,toys,35.98,etl metrics row columnar columnar filter elt data metrics
574,toys,12.33,metrics warehouse row row plan python data shuffle scala
575,electronics,83.65,row elt scala warehouse partition map data spark warehouse
576,electronics,32.72,metrics plan lake lake lake spark spark
577,books,21.35,warehouse python ui join lake shuffle plan reduce ui ui columnar
578,grocery,27.05,elt data aggregate reduce python row lake reduce
579,books,79.11,metrics partition shuffle metrics python filter aggregate metrics elt plan spark
580,books,76.09,python shuffle shuffle partition metrics elt metrics map
581,toys,85.14,plan map etl python columnar
582,grocery,38.79,columnar python plan plan plan map data warehouse metrics partition
583,electronics,45.33,columnar row etl elt lake spark spark columnar aggregate
584,toys,59.82,elt reduce map data ui data columnar aggregate reduce partition plan
585,grocery,0.98,scala scala metrics join warehouse shuffle metrics warehouse
586,grocery,16.78,python filter map partition map data
587,toys,54.13,warehouse shuffle ui warehouse data metrics partition columnar
588,grocery,86.33,join partition reduce warehouse etl map metrics etl
589,grocery,36.85,lake etl ui filter map join plan columnar shuffle python shuffle lake
590,electronics,60.64,join python partition reduce map row spark data aggregate lake python
591,electronics,42.37,ui shuffle join warehouse python spark elt partition warehouse warehouse
592,books,29.71,join partition row row aggregate partition reduce map metrics
593,books,99.26,etl python plan python metrics columnar warehouse map
594,toys,29.64,etl filter row ui ui spark scala etl warehouse map
595,electronics,5.66,aggregate ui scala partition join metrics reduce columnar shuffle map reduce spark
596,grocery,85.33,map reduce warehouse map filter map map
597,electronics,36.23,row partition etl spark join reduce python row scala map filter filter
598,toys,89.99,join python scala shuffle lake partition reduce ui scala etl filter
599,toys,80.96,metrics aggregate columnar python row metrics python
600,grocery,29.71,shuffle row reduce row scala shuffle metrics shuffle
601,books,85.82,warehouse join spark spark elt scala
602,electronics,15.46,row reduce etl warehouse map row elt shuffle metrics filter
603,toys,55.78,etl etl lake lake reduce
604,toys,34.24,reduce ui ui join reduce data scala
605,grocery,60.23,metrics etl map row map partition plan map join ui etl python
606,toys,65.59,filter shuffle plan filter shuffle shuffle ui shuffle data partition join warehouse
607,toys,80.14,columnar spark data columnar scala spark plan ui
608,books,20.48,plan python map python aggregate scala ui
609,toys,36.01,lake filter python columnar elt
610,grocery,57.12,python scala data filter row plan metrics etl
611,books,34.27,reduce columnar shuffle elt columnar data reduce data ui map
612,books,70.02,lake spark columnar spark python elt shuffle
613,toys,68.68,aggregate partition map aggregate columnar elt map spark map scala warehouse warehouse
614,toys,0.33,columnar shuffle scala columnar aggregate
615,grocery,31.69,aggregate filter reduce scala scala scala spark data python etl filter spark
616,electronics,29.34,elt spark elt ui row
617,books,99.76,scala partition aggregate aggregate data ui etl plan ui lake
618,toys,39.28,row ui spark plan aggregate metrics scala spark aggregate aggregate
619,grocery,27.38,spark reduce plan metrics join data shuffle filter data
620,toys,40.27,shuffle elt lake partition reduce aggregate partition warehouse elt
621,books,1.31,filter row partition aggregate shuffle ui warehouse metrics join metrics
622,electronics,28.48,map warehouse filter lake aggregate partition join python python python scala shuffle
623,grocery,45.53,elt shuffle scala row join lake plan reduce data ui shuffle partition
624,electronics,93.21,etl reduce data join data python metrics spark filter etl aggregate row
625,electronics,83.29,map partition scala columnar elt lake spark scala
626,toys,49.42,ui row reduce columnar plan join lake elt elt shuffle
627,electronics,55.57,ui ui aggregate map join etl python elt map partition data
628,electronics,69.94,scala partition join row ui lake
629,electronics,56.66,ui plan data shuffle plan join ui scala join
630,toys,77.73,data row etl shuffle columnar etl shuffle elt scala python lake elt
631,books,24.71,warehouse aggregate row join filter shuffle plan
632,electronics,15.59,map plan lake lake lake scala partition
633,toys,86.18,warehouse metrics python spark lake partition
634,toys,73.89,filter lake ui reduce etl partition scala ui
635,electronics,98.92,columnar aggregate partition aggregate partition aggregate python warehouse lake shuffle join
636,grocery,23.09,python elt warehouse elt join filter
637,books,2.63,reduce ui filter plan ui columnar
638,books,45.88,scala columnar elt plan aggregate filter ui reduce row
639,electronics,49.29,reduce ui map reduce join join columnar spark filter aggregate
640,toys,21.71,elt lake elt aggregate columnar scala row warehouse map etl
641,toys,4.36,reduce lake data data scala spark
642,toys,67.34,plan elt data scala row metrics map plan row filter
643,electronics,63.79,python filter map aggregate shuffle shuffle scala
644,toys,15.45,metrics aggregate map lake metrics ui metrics reduce ui data
645,electronics,55.77,partition spark columnar lake warehouse
646,books,17.9,columnar scala elt etl etl warehouse etl python map
647,toys,34.44,reduce map etl warehouse spark join spark
648,grocery,92.47,spark scala join lake metrics shuffle columnar metrics row shuffle plan
649,electronics,76.32,plan metrics columnar aggregate ui shuffle columnar join etl ui columnar
650,toys,63.41,columnar map map elt filter map warehouse row row join ui
651,books,44.92,ui data scala aggregate etl elt elt shuffle data
652,toys,77.7,spark warehouse join join ui columnar row map ui etl elt data
653,electronics,67.91,map columnar ui data shuffle warehouse scala scala etl filter
654,grocery,73.28,elt map lake aggregate partition aggregate shuffle filter
655,grocery,36.43,map elt metrics python partition
656,electronics,79.65,filter map lake elt row row
657,toys,80.17,scala spark etl spark data
658,toys,18.86,data partition scala plan ui map python etl data metrics elt data
659,grocery,87.62,aggregate ui plan python etl warehouse
660,grocery,78.95,aggregate data map warehouse elt metrics partition map filter scala
661,toys,7.52,data map partition shuffle shuffle map join filter python shuffle
662,books,71.86,warehouse spark data join lake join spark etl metrics partition
663,toys,8.7,metrics data warehouse spark warehouse scala aggregate plan
664,grocery,24.98,map plan spark columnar python shuffle columnar ui join lake
665,toys,48.78,reduce partition etl spark plan row filter
666,books,92.8,lake spark shuffle scala reduce lake elt reduce plan filter
667,grocery,11.35,python spark spark lake elt lake partition elt scala ui ui shuffle
668,books,96.86,join shuffle partition spark aggregate data data
669,grocery,66.67,warehouse python join map python lake warehouse aggregate ui
670,books,82.73,filter partition aggregate warehouse python metrics
671,electronics,66.71,ui map shuffle etl reduce warehouse
672,toys,88.28,filter etl row python join elt metrics
673,books,49.2,spark map spark metrics row columnar
674,electronics,55.92,metrics data scala scala partition map python data row
675,toys,69.98,aggregate data warehouse metrics plan warehouse python data columnar shuffle
676,toys,33.64,python aggregate ui row join
677,grocery,4.78,partition metrics filter python plan reduce ui
678,electronics,13.64,join lake plan partition join scala
679,books,70.44,join scala map python spark metrics metrics row data
680,electronics,77.11,python reduce ui data lake filter spark data reduce shuffle row
681,toys,39.33,metrics ui spark row plan columnar join partition scala join plan
682,toys,21.28,filter lake elt etl plan aggregate lake filter shuffle plan plan spark
683,grocery,28.86,columnar warehouse etl join warehouse etl data
684,electronics,15.18,reduce plan ui etl metrics plan
685,electronics,77.57,plan columnar columnar partition python
686,toys,36.46,partition elt aggregate aggregate partition row etl plan partition map
687,toys,65.76,scala plan partition data reduce
688,grocery,15.29,elt data map map ui map
689,books,90.0,row reduce spark aggregate plan map scala join aggregate elt
690,grocery,76.82,columnar spark metrics filter ui metrics reduce map filter lake
691,books,29.21,ui filter etl reduce plan data data reduce
692,electronics,79.69,join partition columnar metrics filter partition data python aggregate
693,books,36.11,row spark scala shuffle scala spark map columnar scala data row row
694,toys,92.66,ui map lake aggregate scala
695,toys,31.79,partition metrics etl join filter data
696,electronics,85.8,elt scala columnar python metrics scala
697,toys,21.86,columnar python scala map ui row spark aggregate data columnar etl python
698,books,12.75,etl etl columnar lake spark metrics row
699,grocery,67.85,shuffle etl partition ui lake lake filter etl filter python elt
700,toys,5.22,join partition filter python join map warehouse elt ui ui filter aggregate
701,toys,9.56,columnar lake join data metrics elt join
702,electronics,69.05,filter plan elt map lake row filter elt
703,toys,3.56,elt map plan data scala python row python map
704,grocery,75.27,columnar elt warehouse etl etl map spark plan reduce ui filter ui
705,books,51.92,spark map map lake row filter plan
706,grocery,18.47,filter join aggregate metrics warehouse partition join reduce
707,toys,17.15,spark etl elt etl elt scala
708,electronics,18.34,plan lake elt data filter columnar partition shuffle etl
709,books,89.74,join row columnar join spark partition warehouse reduce row row reduce
710,grocery,22.05,columnar map map join join join row etl
711,grocery,62.46,shuffle lake etl join row
712,toys,39.73,partition data spark map warehouse row etl join columnar
713,books,93.28,map etl scala lake python ui data columnar etl warehouse shuffle warehouse
714,books,78.57,reduce scala columnar ui join plan etl elt
715,books,30.23,warehouse elt python spark elt columnar elt lake reduce ui
716,electronics,19.62,reduce lake lake scala scala partition row metrics row shuffle plan map
717,grocery,51.11,python map warehouse metrics reduce join shuffle map shuffle plan lake
718,books,1.21,spark columnar lake row scala filter reduce aggregate
719,grocery,95.05,ui python data data etl columnar scala plan
720,toys,73.96,row etl elt plan filter python spark spark filter ui
721,electronics,44.97,ui join map scala scala data
722,books,23.22,shuffle aggregate columnar aggregate elt python data reduce ui aggregate aggregate
723,toys,74.2,aggregate scala python join metrics columnar columnar shuffle spark
724,electronics,54.23,metrics aggregate python shuffle reduce row plan join
725,electronics,67.61,spark etl map spark elt partition metrics filter data spark
